MovieID,Title,Genre,Description
1,The Matrix,Action|Sci-Fi,"A computer hacker learns about the true nature of reality and his role in the war against its controllers."
2,Inception,Action|Sci-Fi|Thriller,"A thief who steals corporate secrets through dream-sharing technology is tasked with planting an idea into a CEO's mind."
3,Toy Story,Animation|Comedy|Family,"Toys come to life and embark on adventures when humans are not around."
4,The Godfather,Crime|Drama,"The aging patriarch of an organized crime dynasty transfers control of his empire to his reluctant son."
5,The Dark Knight,Action|Crime|Drama,"Batman faces the Joker, a criminal mastermind who plunges Gotham into chaos."
6,Finding Nemo,Animation|Adventure|Family,"A clownfish sets out on a journey to find his son who was captured by divers."
7,Interstellar,Adventure|Drama|Sci-Fi,"A group of explorers travel through a wormhole in space to ensure humanity's survival."
8,Avengers: Endgame,Action|Adventure|Sci-Fi,"The Avengers assemble once more to reverse the damage caused by Thanos."
